{"schemaVersion":2,"runId":"luna-terra-sol-pilot-2026-07-15","stage":"luna_scout","model":{"id":"gpt-5.6-luna","reasoningEffort":"low"},"restaurant":{"restaurantId":"osm-babylon-futbol-9311198934","name":"Babylon Futbol Cafe","baselineItemCount":30,"baselineItemFingerprint":"e933fe6adf078494dc2b2a1bdbe2a9ae02cb7b628a1d429fc1d137f696ec36f8"},"outcome":"discrepancy_found","confidence":{"level":"medium","overall":0.78,"menu":0.85,"allergenSource":0.55,"extraction":0.82,"rationale":"Official food, happy-hour, shisha, brunch, bottle, reservation, and linked ordering surfaces were inspected. Every surface-referenced currentProductKey is defined in currentProducts; allergen disclosure remains incomplete."},"identity":{"verdict":"verified","scope":"Falls Church location, 3501 S Jefferson St, Falls Church, VA 22041; babylonfc.com","confidence":0.98,"sourceEvidenceIds":["src-official-food-menu","src-official-reservations"],"notes":"Official pages identify Babylon Futbol Cafe at the frozen Falls Church location."},"sources":[{"evidenceId":"src-official-food-menu","url":"https://www.babylonfc.com/menu","authorityTier":"restaurant_issued","purpose":"menu","title":"Food Menu | Falls Church, VA","retrievedAt":"2026-07-15T22:00:00Z","excerpt":"Official food menu.","stableRowId":null,"contentHash":null,"artifactSuggested":"official-food-menu.html"},{"evidenceId":"src-official-happy-hour","url":"https://www.babylonfc.com/happy-hour","authorityTier":"restaurant_issued","purpose":"menu","title":"Happy Hour Specials","retrievedAt":"2026-07-15T22:00:00Z","excerpt":"Happy-hour food bites.","stableRowId":null,"contentHash":null,"artifactSuggested":"official-happy-hour.html"},{"evidenceId":"src-official-shisha","url":"https://www.babylonfc.com/hookah-mneu","authorityTier":"restaurant_issued","purpose":"menu","title":"Shisha Menu","retrievedAt":"2026-07-15T22:00:00Z","excerpt":"Official shisha flavors and price periods.","stableRowId":null,"contentHash":null,"artifactSuggested":"official-shisha-menu.html"},{"evidenceId":"src-official-bottle","url":"https://www.babylonfc.com/bottle-menu","authorityTier":"restaurant_issued","purpose":"other","title":"Bottle Menu","retrievedAt":"2026-07-15T22:00:00Z","excerpt":"Alcoholic bottle service excluded from the food catalog.","stableRowId":null,"contentHash":null,"artifactSuggested":"official-bottle-menu.html"},{"evidenceId":"src-official-reservations","url":"https://www.babylonfc.com/reservations","authorityTier":"restaurant_issued","purpose":"identity","title":"Reservations","retrievedAt":"2026-07-15T22:00:00Z","excerpt":"Official address and reservation products.","stableRowId":null,"contentHash":null,"artifactSuggested":"official-reservations.html"},{"evidenceId":"src-official-brunch","url":"https://www.babylonfc.com/brunch--nfl-menu","authorityTier":"restaurant_issued","purpose":"menu","title":"Brunch - NFL Menu","retrievedAt":"2026-07-15T22:00:00Z","excerpt":null,"stableRowId":null,"contentHash":null,"artifactSuggested":"official-brunch-menu.html"},{"evidenceId":"src-linked-grubhub","url":"https://www.grubhub.com/restaurant/babylon-futbol-cafe-3501-s-jefferson-st-falls-church/6456096","authorityTier":"restaurant_linked_vendor","purpose":"menu","title":"Babylon Futbol Cafe Delivery Menu","retrievedAt":"2026-07-15T22:00:00Z","excerpt":"Linked ordering menu with duplicate food presentations and can sodas.","stableRowId":null,"contentHash":null,"artifactSuggested":"grubhub-menu.html"}],"sourceAttempts":[{"kind":"official_site","status":"accessible","url":"https://www.babylonfc.com/","notes":"Official homepage and linked surfaces accessible."},{"kind":"linked_source","status":"accessible","url":"https://www.babylonfc.com/menu","notes":"Official food menu accessible."},{"kind":"ordering_vendor","status":"accessible","url":"https://www.grubhub.com/restaurant/babylon-futbol-cafe-3501-s-jefferson-st-falls-church/6456096","notes":"Linked ordering menu accessible."},{"kind":"targeted_search","status":"accessible","url":"https://www.google.com/search?q=Babylon+Futbol+Cafe+Falls+Church+menu","notes":"Official and linked pages located."},{"kind":"archive","status":"not_found","url":null,"notes":"No archive evidence used."},{"kind":"third_party","status":"accessible","url":"https://www.allmenus.com/va/falls-church/679692-babylon-futbol-cafe/menu/","notes":"Located but not relied upon for official catalog."}],"menuSurfaces":[{"surfaceId":"surface-food","title":"Food Menu","service":"all-day food","url":"https://www.babylonfc.com/menu","authorityTier":"restaurant_issued","mediaType":"html","accessStatus":"accessible","fullyEnumerated":true,"scopeStatus":"complete","current":true,"sourceEvidenceIds":["src-official-food-menu"],"currentProductKeys":["chips-salsa","nachos-con-todo","fried-mozzarella","potato-skins","fried-calamari","babylon-wings","southwestern-egg-rolls","catfish-nuggets","quesadilla","steak-cheese-egg-rolls","buffalo-shrimp","chicken-fingers","soft-tacos","fried-chicken-slider","pizza-pomodoro","vegetable-pizza","gyro-pizza","cheese-pizza","pizza-club","white-pizza","pizza-my-way","babylon-burger","vegetable-burger","shrimp-poboy","southwest-burger","steak-cheese","steak-caesar-wrap","chicken-sandwich","gyro","chicken-jose-special","crispy-cajun-chicken-sandwich","grilled-salmon-wrap","buffalo-chicken-wrap","grilled-ham-cheese","fried-chicken-sandwich","house-salad","caesar-salad","greek-salad","sega-tibs","doro-tibs","chicken-fried-rice","chicken-shrimp-fried-rice","shrimp-fried-rice","chicken-beef-fried-rice","cajun-shrimp-pasta","fettuccine-alfredo","chicken-kabob","lomo-saltado","arroz-con-pollo","chicken-fajitas","steak-fajitas","fajita-el-rey","new-york-steak","lamb-chops","smothered-chicken","grilled-salmon","camarones-al-ajo","catfish-dinner","seafood-platter","mashed-potatoes","vegetable-medley","mac-cheese","collard-greens","baked-potatoes","rice"],"notes":"No complete allergen matrix."},{"surfaceId":"surface-happy-hour","title":"Happy Hour Menu","service":"Monday-Friday 4PM-9PM","url":"https://www.babylonfc.com/happy-hour","authorityTier":"restaurant_issued","mediaType":"html","accessStatus":"accessible","fullyEnumerated":true,"scopeStatus":"complete","current":true,"sourceEvidenceIds":["src-official-happy-hour"],"currentProductKeys":["hh-chips-salsa","hh-wings-8","hh-fried-mozzarella","hh-potato-skins","hh-fried-calamari","hh-chicken-tender","hh-chicken-quesadilla","hh-beef-quesadilla","hh-shrimp-quesadilla","hh-chicken-taco","hh-beef-taco","hh-shrimp-taco"],"notes":"Alcoholic drinks excluded."},{"surfaceId":"surface-shisha","title":"Shisha Menu","service":"hookah","url":"https://www.babylonfc.com/hookah-mneu","authorityTier":"restaurant_issued","mediaType":"html","accessStatus":"accessible","fullyEnumerated":true,"scopeStatus":"complete","current":true,"sourceEvidenceIds":["src-official-shisha"],"currentProductKeys":["shisha-alfakher-flavors","shisha-starbuzz-flavors","hookah-sun-thu","hookah-fri-sat-2-4","hookah-fri-sat-4-7","hookah-fri-sat-7-close"],"notes":"Non-food tobacco products included because frozen baseline contains them."},{"surfaceId":"surface-bottle","title":"Bottle Menu","service":"alcoholic bottle service","url":"https://www.babylonfc.com/bottle-menu","authorityTier":"restaurant_issued","mediaType":"html","accessStatus":"accessible","fullyEnumerated":true,"scopeStatus":"excluded","current":true,"sourceEvidenceIds":["src-official-bottle"],"currentProductKeys":[],"notes":"Excluded from food/nonalcoholic catalog."},{"surfaceId":"surface-brunch","title":"Brunch - NFL Menu","service":"brunch/NFL","url":"https://www.babylonfc.com/brunch--nfl-menu","authorityTier":"restaurant_issued","mediaType":"html","accessStatus":"partial","fullyEnumerated":false,"scopeStatus":"unresolved","current":null,"sourceEvidenceIds":["src-official-brunch"],"currentProductKeys":[],"notes":"Sparse page content."},{"surfaceId":"surface-ordering","title":"Linked Grubhub Ordering Menu","service":"delivery/pickup","url":"https://www.grubhub.com/restaurant/babylon-futbol-cafe-3501-s-jefferson-st-falls-church/6456096","authorityTier":"restaurant_linked_vendor","mediaType":"html","accessStatus":"accessible","fullyEnumerated":true,"scopeStatus":"complete","current":true,"sourceEvidenceIds":["src-linked-grubhub"],"currentProductKeys":["can-sodas","steak-cheese-egg-rolls","cajun-shrimp-pasta","steak-caesar-wrap","fried-calamari","fried-chicken-slider","chips-salsa","nachos-con-todo","fried-mozzarella","quesadilla","potato-skins","southwestern-egg-rolls","buffalo-shrimp","chicken-fingers","soft-tacos","house-salad","caesar-salad","greek-salad","babylon-wings","pizza-pomodoro","vegetable-pizza","gyro-pizza","cheese-pizza","pizza-club","white-pizza","pizza-my-way","fried-chicken-sandwich","steak-cheese","grilled-salmon-wrap","babylon-burger","vegetable-burger","shrimp-poboy","southwest-burger","gyro"],"notes":"Duplicate presentations consolidated."}],"currentProducts":[{"currentProductKey":"chips-salsa","name":"Chips & Salsa","category":"Appetizers","surfaceIds":["surface-food","surface-happy-hour","surface-ordering"],"presentationIds":["official-standard","happy-hour","grubhub-standard"],"matchedBaselineAuditItemKeys":["15:fried-corn-tortillas-served-with-our-home-made-traditional-mexican-salsa"],"sourceEvidenceIds":["src-official-food-menu","src-official-happy-hour","src-linked-grubhub"],"containsAllergens":[],"mayContainAllergens":[],"allergenEvidenceStatus":"partial_positive_only","allergenSourceType":"restaurant_ingredients","allergenAuthorityTier":"restaurant_issued","allergenSourceEvidenceIds":["src-official-food-menu"],"authorityVerdict":"ambiguous","notes":"Named corn tortillas and salsa; no complete matrix."},{"currentProductKey":"quesadilla","name":"Quesadilla","category":"Appetizers","surfaceIds":["surface-food","surface-ordering"],"presentationIds":["official-standard","grubhub-standard"],"matchedBaselineAuditItemKeys":["2:beef-add","4:grilled-chicken-add","5:shrimp-add"],"sourceEvidenceIds":[